id,video_id,author,text,abusive
UgjACi-uRtP5C3gCoAEC,C5gMfTBIBzc,An7rew,ох ці мрійники що ж з ними буде після підписання чомусь згадав камінний хрест стефаника та інтерв ю бабці з північної кореї яка розповідає про денні пайки у сша сумно ,False
UghmepLKJ6lo33gCoAEC,xTfMbgQqEeg,Дмитрий Российский,стадо диких обезьян какой правды они хотят что они жопу рвут чтобы попасть в ес в который их никто не звал стадо е ное ,True
UgjsUEPSRWPiRngCoAEC,eufNblKL65s,Marta2479,отчитались не волнуйтесь андрей сергеевич цивилизованная европа не будет применять к вам санкций и пустит вас к себе погостить хороший мальчик ,False
UgjsiLgxoXOvmXgCoAEC.7-H0Z7-4xG07-H4ii8Kgx3,8SqTaE4-5a4,Alex Koks,как к тебе обратиться даже не знаю прогугли фото небесной сотни и найди хоть одного алкаша ,False
Ugyie3Tox5J1txs5mO94AaABAg,8SqTaE4-5a4,Кравченко Артём,наши братья почему мы соримся мы же были вместе в ссср ,False
UggCqOgUw0_e1ngCoAEC,yBTb4KZw7vc,Димитрий Соколов,а зачем у всех мирно протестующих закрыты лица это такой стиль дал пизды и убежал ,True
UggSjVW3-2EvMngCoAEC.8DlGdN3rfGA8Frddje0nbJ,AV127gSoJxM,sashapetruk, захар захаров прошло пару лет и всем видно что этот ебанутый шабаш привел украину в жопу стало намного хуже чем было ,True
Ugjav9Biy_fLpXgCoAEC.7-H0Z7-Fyoi7-HYg9EdIkv,GGaQ5BDNouM,Роман Возжаев,когда на тебя всякие личности с двумя высшими лезут со всех щелей и пытаются отпиздить поджечь изнасиловать удивительно что таких случаев мести не так много ты думаешь они просто так там стоят и терпят власть воюет против народа ну да конечно у власти даже у вашей достаточно ресурсов чтобы разогнать любую толпу за пару часов без жертв ,True
Ugy2SexXLxKwUU4bxvJ4AaABAg,F3FXtGjh6Bg,frog2000, россия должна дальше можно не смотреть ,False
UgjnJODU41th2HgCoAEC,eufNblKL65s,ян пшемановский,статистика реальная но давайте задумаемся над маленьким фактом в америке бомжей задумайтесь а теперь задумайтесь почему автор не приводит сравнительную статистику населения в отношении к площади страны ладна бог с ним реально в росссии последние лет идет борьба за выживание но не американцы ли принесли в россию свою идеологию не мвф ли требовало принятия тех или иных законов вспомните кто требовал принятия законов о возрасте согласия в россии напомнить г ну кончаловскому а образование кто требовал от россии принятия именно этих учебников для школы могу напомнить американские фонды и проплаченые депутаты и вот сегодня когда правительство путина вышло из под контроля американцы нажимают на рычаги активируют купленных ублюдков и приводят частичную правду а с другой стороны замалчивают собственное участие за лет путинщины нельзя построить развитое государство не нужно винить одного не замечая другого господин кончаловский реальный мужик но наберись терпения и делай что то для россии конкретно а не кидайся дерьмом к стати господин кончаловский не расскажите ли вы как вам дали возможность снимать фильмы в голливуде напоминаю вас тупо продвинули по личному знакомству а до того тупо отпихивали так что не звезди тут н асчет коррупции она что в росссии что в европе гнилой что в америке одинаково думайте ,True
UgiHkZHZ_yeEc3gCoAEC.7-H0Z7-AlSh7-HAqSMdFb4,0WsJ8-tJeC8,Vitaliy Lozovskiy, константин тычина костя вы не ответили ни на один мой вопрос тут пичалька что на майдане чисто хорошо с этим разобрались а вот остальное плохо жить на свете пастушонку пете пардон плохо и русскому народу и украинскому и вот собираются болотные митинги майданы и все хором заявляют плохо мы живем надо лучше и что и невдомек ни тем ни другим что вы массовка подставные лица опираясь на которые свои вопросы решают другие маккейн макфол который кстати принимал у себя ваших коллег вы пешки в большой чужой игре чужой для всех в первую очередь кто живет и у нас и у вас плохо вы верите что от заклинаний жизнь улучшится либо у вас есть альтернатива тому же путину немцов навальный ксюша ни лидера нет ни программы ни идей по государственному устройству вот в чем проблема а не в том что вас на майдане накормили бесплатно ,False
UggtY509S1LXongCoAEC,xZUzfzTLD4U,Артём Ярёменко,слава героям украины слава украине сегодня майдан а завтра вся украина слава героям україни слава україні сьогодні майдан а завтра вся україна ,False
Ugj3GbBZRVvbGXgCoAEC,V8B4KOpCSV0,Basil Savchuk,ну і бидло ,True
Ugiej7JfG79S83gCoAEC,XK1A8MPb6Ro,Ростислав Дорошенко,одесса с вами ,False
UgjEU5dPSVNGgngCoAEC.7-H0Z7--aBX7-ID2dvbB50,4D2EPDACTqY,Olga Kovalenko,да есть гораздо более страшные вещи ,False
Ughds2oqGfUgbngCoAEC,H_ToRtwlvpI,Владимир Жорикович,слава россии а хохлам гондон в руки ,True
UgiCczqOpEsLTXgCoAEC,u79Uw1hP6dY,Aleksandr Pihulski,бред ,False
Ugju22fY2MyPaHgCoAEC,jRX9Hq08sGc,Dragon Nodus,читайте лучше западные комментарии им явно дешевое рабочее сало не нужно у них там и так полно чурок а тут еще сало с тухлой экономикой подметите у себя лучше во дворе и станьте европейцами а не теми проплаченными мудозвоннами с еврожопы ,True
UghtZFuvpF6qwXgCoAEC,8SqTaE4-5a4,Анна Иркова,не люблю русский реп но эта песня тронула до слез ,False
UgiKjklda8IftXgCoAEC.7-H0Z7-FJr7700GegPipSx,8E4dT0qGPKg,Валерий Петров,ты можешь нахуй идти и америка твоя тоже с тобой же нахуй идет ,True
UgjXzVk1JylJ7HgCoAEC,xTfMbgQqEeg,ЛУЧШИЕ ПРИКОЛЫ,лучшие приколы за неделю заходите и зацените ,False
Ugg4R13kIRfnmXgCoAEC,V8B4KOpCSV0,Марина Бойко,выступление сумбурное чересчур эмоциональное но это неважно главное суть должна заметить странное устройство мозгов у свидомых сначала мерзли на майдане против олигархата за новую социально справедливую украину при этом сами снова привели во власть прежних олигархов и под их улюлюканье отправились убивать своих же соотечественников на донбассе которые учредили республику народовластия и объявили о национализации собственности незаконно приобретенной олигархами скорее всего именно это фактор является определяющим почему российская верхушка не спешит на помощь нарождающейся новороссии боятся что эта антиолигархическая зараза может перекинуться и на восток а что же граждане незалежной вместо того чтобы объединиться с жителями донбасса и довести наконец свою революцию до ума они исходят желчью по поводу путина и рукоплещут когда олигархи устраивают настоящий геноцид под луганском причем их же собственными руками их даже не смущает что новая старая власть уже и майдан объявила вне закона где логика граждане революционэры ,False
UgiM981MtGKiwXgCoAEC,GGaQ5BDNouM,Sasha Feshchenko,це прекрасно ,False
UgjUzddHiik9zXgCoAEC,T6IbEIBhb8o,c1cer0n,майдановцы первые начали стрелять боевыми а силовикам что теперь пончиками стрелять все майдановци обезумевшие терористы которые хотят свою страну в крови утопить и за бугор свалить им сша давно уже огнестрельное оружие раздало а предатели считают что мир демократичнее станет если помогут из своей страны превратить сделать сирию ,False
Ughroytn0fqNG3gCoAEC,eufNblKL65s,maxOOs,ну и бред ,False
UgipGGc_WkEnH3gCoAEC,zCmV4dX5tgs,Антон Антонов,справа какой то гопник в очках ,False
Ugg6UplmBvp39HgCoAEC.7-H0Z7-0kRD7-HS4vs83hJ,xTfMbgQqEeg,nordheart, а ты хоть раз замечал обман на хохляндском тв хотя я спросил о конкретном вранье которое так возмутило украинских оппозиционеров а ты мне ни одного примера не привел ,True
Ugin8tnCxQwQpHgCoAEC,zCmV4dX5tgs,Фридрих Энгельс,рудольфыч красав аще ира сдулась еще вчера одни пузыри ,False
UggW4ZkB5_wjEHgCoAEC.7-H0Z7-20au7-I3f9s0B3t,SwZ_LW9NsUE,Alexandr Treyman,вот скажите неужели на донбассе все так хорошо что люди до сих пор верят в пр и зека ,False
UghWvMgirGwEz3gCoAEC,rngYEzRxlWU,Armannni880,этой ночью снова украинская национальная гвардия устроила минометный обстрел с боевых вертолетов жилых домов в городах юго востока расстреляли общежитие педагогического института лечебное учреждение славянска жертвы среди безоружного населения растут украинские военные напали и расстреляли в упор санитарный грузовик перевозивший под флагом медицинской помощи раненных ополченцев донецка никто из раненных не выжил юго восток можно убить но его душа никогда не простит украинский фашизм тех кто потерял на этой гражданской войне в украине своих родных и близких уже ничто и никогда не объединит с их убийцами ,True
UggpcfFnbA8WnngCoAEC.7-H0Z7-6MTn7-H9kX-7Gni,0k8GVmgB9Hw,Sergey Nenado,третьего в лучшем случае ,False
Ughg_H8sldpnwngCoAEC.8C6vZVjfRWO8bqJ1N-c8KB,8SqTaE4-5a4,†ПеЧеНьКа†,влад крамар а мы как тараканы еще живи ,False
UgiLB1LHT2VeY3gCoAEC.7-H0Z7-PDjR7-IarGgGCeQ,E950t1WGiE0,Ира Толстокулакова,миру мир ,False
Ugi2Jh3QCnJzd3gCoAEC.7-H0Z7-1Xl07-abUwG9gze,Lu2AObax0lo,stas2192,иди на большой и толстый хуй носорог черный ,True
UgjHELfUgNgZ0HgCoAEC,GGaQ5BDNouM,Женя Онопенко,а в росії як завжди обективно відреагували зазначивши що екстремісти захопили київську філармонію та змушують грати німецькі марші ,False
UggMKJEa9RkpSngCoAEC.7-H0Z7-4BcI7-HQy654RTr,FXCliOGt0Jc,Иван Тольятти,все правильно говорите степан ,False
UgjsJ4WyokSjiXgCoAEC,enboWY3ITe0,Ильич,название не правильное это надо было назвать отличные кадры жаль только что всю эту фашистскую гниль тогда на майдане не положили а положили бы то не было бы сейчас тысяч жертв надо было тогда дать беркуту огнестрел и приказ о стрельбе на поражение ,True
UghLTCOZlpabZ3gCoAEC,AyVvGv4Seag,Евгений Безверхний,жаль что нет больше такой группы ,False
UgjBGb8bbbqb2XgCoAEC.7-H0Z7-N2uA7-xNDfT4Cve,3-F4MxRqKFg,gvardeez75,какая единая и неделимая вы хотите и уже убиваете друг друга видел я как майдауны ловили автобусы автомайдана на трассе пендосы потирают ручки единый народ продолжай в том же духе уничтожать сам себя ,True
UggN-U__7g6QUHgCoAEC.7-H0Z7-U3MX7-H5QnBDygh,T6IbEIBhb8o,skb Sokoban, виктор гущин причем в начале ты говоришь у вас там но у нас тут ты знаешь лучше оттуда чем кто то здесь ,False
UghiODO6E8ZlFngCoAEC.7-H0Z7--qMm72-YXCsB4Xx,H8ABnhoxhMw,Evil Death Muscovites,яка тобі різниця кацапе з яких я військ ти ж також не з зелених беретів якщо кацап захищає свою московію він патріот а якщо українець боронить україну він бєндєровєц правасєк діванниє вайска і т п я з тих військ кацапе які люто ненавидять твою тоталітарну парашу і воюю з нею усіма доступними мені методами ,True
Ugi9xO5esEMCPngCoAEC,Qoz0IXn5jg8,Rus TK,дурочка нашла кому подпевать ,True
UghQQX6gK8LzKHgCoAEC,rl6PzLyKt_s,Jonlaut,а теперь эти ссуки в масках защищают днр ,True
UggeGnsjN7nwQHgCoAEC.7-H0Z7-0TVG7-OJ_SxYqGH,FXCliOGt0Jc,itwowed, леонид гутник тоесть миллион госслужащих лгут все поголовно я думал так только подростки рассуждают из за переходного возраста а оказывается не только они печаль ,False
UgjGI_ExjmF_LHgCoAEC.7-H0Z7-Rwgd72-sB3b9e4R,eufNblKL65s,denis kyrnosov, дионисий былов хаха здорово сказал я бы не догадался ,False
UgjWbLqJPmMinXgCoAEC,GGaQ5BDNouM,Buket_ gvozdei,а что за музыку он играет ,False
Ugi7lhhsG3NkEHgCoAEC.7-H0Z7-TRh07-HEACzK3oE,GGaQ5BDNouM,Alexander Myshalov,придут к власти те кого выберут на новых выборах а вы пожизненно будете рабами с путином и ты артем выйти сказать не сможешь ничего потому что посадят тебя в клетку как обезьяну ,False
UghHjiS8SXGQDHgCoAEC,AdU2o8BcZ4Q,Verdens Vandrer,эти новоиспеченные европейские шавки литва польша как в финансовой пирамиде хотят найти дурачков под себя ,False
UghjqAa5bhBVEXgCoAEC.7-H0Z7-SmiZ7-O7aIvwtR6,xTfMbgQqEeg,Yaroslav Bakhovsky,я не вижу смысла в дальнейшем диалоге сходи на майдан и узнай ,False
UghPNEbn8CpSx3gCoAEC.7-H0Z7-9pDF7-JRZeZQ1Es,H8ABnhoxhMw,yescom84,за людей бандити на жаль у нас у владі ,False
Ugj14L734l7SB3gCoAEC,KTtAtejbA88,владимир суровый,сразу видно европейцы ,False
UgiB5b77E4I3h3gCoAEC.7-H0Z7-RF-a7-H121evNPO,T6IbEIBhb8o,romanbezruchen,а то что вся эта клоунада на майдане проплачена евросоюзом ты еще не поверил ,False
UgjnxWjL6KjLzHgCoAEC.7-H0Z7-3dTj7-XvsM7zxii,wObv3OVPk30,Андрей Ковальчук,ребята ругайтесь где нибудь в другом месте а не комменте моем ,False
UgjAUtp5eJ8TLXgCoAEC,FXCliOGt0Jc,Толик Камушкин,не хочу обидеть фанатов федорова я не белоленточник и не либерал я против революции и т д и т п но я уже не могу воспринимать его всерьез с каждым разом я прихожу к выводу что он несет какую то хуйню я уже когда начинаю смотреть ролики федорова меня пробивает на ржачь самое прикольное на мой взгляд это тот факт что он все это выкладывает в ютуб если бы я был агентом спецслужбы сша и следил за тем что говорит федоров я бы наверно обоссывался со смеху от того что я вижу и слышу ,True
UgjRIgsxAVMr9XgCoAEC,FRJ5lATBVdA,Vasiliy Bashnya,красава ,False
UgjPTp42VYUG13gCoAEC.7-H0Z7-I8ut7-TGMTYul-9,zCmV4dX5tgs,Elena Sapphire, константин машанов уважаемый неглупый поклонник либерасток есть шумерская пословица хорошо одетому всегда рады именно по одежке встречают поскольку материя первична и не существует содержания без формы иначе никто ничего не увидит и не поймет ,False
Ugi46uwcFX3pC3gCoAEC.7-H0Z7-7Tr77-I3igLheCo,F_y2fwWwyrU,Александр Атаманенко, иля илевич лет в армии ,False
UghxCnCoZxozr3gCoAEC.7-H0Z7-P6pY7-JgAiKhBWb,8SqTaE4-5a4,Provokator, гейропа говоришь я бы мог но не хочу словами ярмака назвать россию не напрашивайся ,True
UggqI9tpLXGeZ3gCoAEC,gapDCCE1NHU,VIPYouTube,посмотрите что стало с югославией тот же сценарий безработных рак за вами выбор ,False
UgybjFwnGFeRCaqaMHR4AaABAg,8SqTaE4-5a4,Андрій Бузурний,клас але в кінці прапор ,False
Ugg_QpZ1xn-fUXgCoAEC.7-H0Z7-UPEt7-Imqnp7yb7,AyVvGv4Seag,Микола Шешеня,понятно спасибо за информацию ,False
Ughj6F8XOZk0S3gCoAEC.8KGtW_3-lSn8LxPHshWLrp,8SqTaE4-5a4,Wopper, мар ян вівчарук смерть ворогам ,False
UgiB6XC8zxtFpHgCoAEC,T6IbEIBhb8o,Иван Иванов,янык трусливое чмо поддался на давление горстки мразей из западной украины ,True
UgiRB0ZiLoAiO3gCoAEC,8KdRjB7CpDo,DionSirakuzkii,ахахахах так смачно оскорблять умеет только анатолий шарий ,False
Ugi6aknVBLg07XgCoAEC,zCmV4dX5tgs,Stanislav Parhomenko,молодец вероника крашенинникова нас обманивают и никакой выгоды от вашего евросоюза нет тупо использование как подстилку для их же реализаций ,False
Ugjds6fuFJUZt3gCoAEC,eufNblKL65s,Максименко Славянский,о и еще про молодой народ как то смешно вы же взрослый человек ,False
Ugh2svNhnifS73gCoAEC,Ftny4OUEc6I,дядя дядькин,из человек только еврогеи кличко был боксерем а стал пидаром носки вам в рот ,True
UgjMS7iV3gp4KHgCoAEC,H8ABnhoxhMw,Сергей Балабанов,я даже не думал что хакамада такая дура вот из за таких дур такую страну просрали подстилки американские придурочные думают что америкосы будут качать нашу нефть а деньги нам отдавать и мы сразу жить станем богато и хорошо пусть пообщяется с гражданями ирака стали они жить хорошо после того как саддама расстреляли и нефть стали качать американские компании ,True
UgjHtvQclZWBFHgCoAEC,0WsJ8-tJeC8,AlexDnepr67,спасибо за объективный взгляд на евромайдан ,False
UgiocB3xM70H7ngCoAEC.7-H0Z7-8Dd67-HNyJa-ETi,KUCR8xORoUo,Народ Русский,путин тебя погладит добрый ты человек ,False
UghCBd7voPwJQ3gCoAEC,T6IbEIBhb8o,Аромей,это не беркут ,False
UgjbDytk1-6OHXgCoAEC,gqY8gUuN7_M,Schnee Stern X,молодець ось і відмінність між революціонерами та сепаратистами якщо не сказати терористами ,False
UgilP9y0iEknaHgCoAEC,SwZ_LW9NsUE,Yura Octavian,формула существования русского глядя на меня блюют значит я существую ,False
UgjmbjQwyzegnXgCoAEC.7-H0Z7-DFFO7-V48Rj-APO,Ftny4OUEc6I,Neo Neovich,а что это у нас за производство когда люди получают зарплаты которые только на еду и хватает а ну ответь мне на вопрос что это за производство такое которое не может обеспечить нормальную жизнь рабочим этого производства производства довно уже нет и терять нечего ,False
Ugj-trDsTi7F0ngCoAEC,8KdRjB7CpDo,SiriusBit,вот бы все журналисты такие были и жить было бы лучше благодаря хунтовидению и его журнашлюхам столько дел натворили столько судеб сгубили для них надо возвращать высшую меру ,True
UgifJenalL_XU3gCoAEC,cbbj52UD9-s,deberzpref,европе не нужна я страна мира украиной играют как инструментом чтобы по щекатать нервы россии не более того наивные для европы вы дикари им не нужны беженцы ,False
UgwocgnQRBHBn5FpzAl4AaABAg,H8ABnhoxhMw,вася цуркан,кто бы мог подумать на программе соловьева что бы выиграл человек с демократическим взглядом хакамада молодей вставила пе стон и соловьеву и какой то там веронике ,False
UghJH9K3Een4_HgCoAEC.8B_UlXQrWdc8CzXNDfwfZl,8SqTaE4-5a4,Дмитро Павлишин,нам ненужни такие союзники прости если чемто задел ,False
