id,video_id,author,text,abusive
Ugg-760PTdEPkXgCoAEC,3KyjqEmLJ7E,ИЛЬЯ МУРОМЕЦ,всем холодный душ из водомётов и не одного европидо ста не останеться ,True
UgjBgygn4Vx-XngCoAEC,BU3i_j000iA,171marela,я поляк я люблю тебе ,False
UgiV35tri5TvZ3gCoAEC,fcfF_63Rk_o,Red Scorpio,автор хуй из рта вытащи беркут герои ,True
UgiYhfSCC5t3o3gCoAEC,5eTgme4dcFg,Яга Баба-Яга,позор януковичу не замочил майданщиков продажная скотина ,True
UghO9NcLpbcEIXgCoAEC.7-H0Z7-3vFX70NqAnnuUSs,gWKCJyq_kJ8,Zavalnik Zav,легче всего обвинять россию ,False
UghgaPgvjnQfzHgCoAEC,T6IbEIBhb8o,Мего лалка,росия говно україна країна героїв ,True
UgjMFUtRFb-b4HgCoAEC,T6IbEIBhb8o,MrDjvira,эх с танком бы куда круче смотрелось ,False
UggxI35J2d-2eHgCoAEC,XW6hWPZglv8,Саша Фисюк,як так можна брат на брата ,False
UgiMA8qotespPHgCoAEC.7-H0Z7-UWX07-IUAKO6NxB,SwZ_LW9NsUE,Вячеслав Савельев, владимир владимирович кто бы говорил ,False
UgihcfQzWHplgHgCoAEC,zCmV4dX5tgs,XOXLAND,сука она продажная сколько ей платят за этот бред тварь как её ещё слушают люди и терпят это ,True
Ughiz4ANdPijkXgCoAEC,rngYEzRxlWU,339310able,что же ты не спишь сша там где ты всегда война ,False
UggAUX1vUDbJ-XgCoAEC,xZUzfzTLD4U,Suri,ну что ребята прислушаемся к словам янушеску вставай украина ,True
UgjH1P3xVtimBHgCoAEC,KUCR8xORoUo,Aleksey Kokleev,мы же один народ вы друг друга ненавидите так нельзя ,False
Ugy97_tlv6lme9BErd14AaABAg.8_RaX4bMVl28_SbhmOax1X,RMxbOKbjX3A,Андрей Н,роман сыроватко страна стремительно деградирует из за таких тупых уродов как ты ,True
Ugiehjm10a5Fd3gCoAEC.7-H0Z7-KDVY7-NkL6heNSZ,Ftny4OUEc6I,Oleg Hrolfr, сеера макс я живу в восточной украине уж здесь самая задница ,True
Ugj_juuAOLnEK3gCoAEC.7-H0Z7--GGH7-QkusDivra,xZUzfzTLD4U,TheCharlieGordon, я українець а мне пофиг мне коврик нужен реальность как раз именно логике он и поддается если бы люди руководствовались просто логикой такие тупые ситуации были бы невозможны зачем кому то или чему то служить вообще люди рождаются не для того чтобы служить разве беркутовцы служат развен это не работа они не могут просто уволиться военные понятно они присягали какому то абстрактному государству формально они связаны обязательствами ,True
UgjEIsz1F-4ikXgCoAEC,T6IbEIBhb8o,Dmitry Semenenko,на видео анти террористический отряд сбу а не беркут допрыгались теперь валить будут ,False
UghWRefj7Pzr_3gCoAEC,NiT0zcDA9RU,Dima Maximencko,правильно делают что мнут бока быдлоте которая вышла за гривень на площадь жалко не применили водомёты ,True
UggpvE5RiAbDP3gCoAEC.7-H0Z7-7Tk97-SgaWR06Vu,zCmV4dX5tgs,Дмитрий Жуков,угу между псковом и новгородом тоже не может быть никаких союзов а еще между мурманском и владивостоком между киевом и москвой между питером и челябинском ,False
UggrnscwTfj8A3gCoAEC.7-H0Z7-AlLD7-H9g2nVxXS,IqFdatdem64,Виктор Головьев,жаль что так получилось ,False
Ugi8fALTQTSXPXgCoAEC,P0lJZttUnHE,Дракон Глаурунг,обычно люди пытаются вытереть лицо а эти специально такие ходят чтобы больше эффекта были получили звизды ,True
UggTUmvh4XdcPXgCoAEC,KUCR8xORoUo,Dima Jimmy,до сашо завжди була і є велика повага ,False
Ugj04IDXkR84DHgCoAEC.7-H0Z7-QRtA7-ae76IDIre,IqFdatdem64,Oksana Ukraine,героям слава ,False
UginuofL02bkZHgCoAEC,zCmV4dX5tgs,валерий половянский,а я думаю хакамада очень умная женщина а крашенинникова российская шовинистка если украинец любит свою родину он националист россиянин любит свою родину он патриот ребятки как это понимать ,False
UgipG8jqW_mve3gCoAEC,ihixlCUv3tY,wragIII,ахаха так и надо мразям либерастам беркуту зачет ,True
UgjRpwLR0Ti7qXgCoAEC,o9hyneGbGoM,Евгений Шульган,вместо того что бы работать ходят машут флагами и катаются на мопедах работать надо на благо своего будующего ,False
Ugixss9VD__6BHgCoAEC,xZUzfzTLD4U,backtobecks,с такими людьми рядом не страшно было умирать спасибо майдану ,False
UggmjVCvayZ6PXgCoAEC.7-H0Z7-3-6c7-R6D4CufpA,AyVvGv4Seag,stanyuk,ещё один зомбированный москалёныш бедааа ,False
UggfYSjT3Zh9FXgCoAEC.7-H0Z7-EV1E7-OHGbTsP6H,xZUzfzTLD4U,Arseniy Yavorśkyi,вже є вулиці досі повні ,False
Ugg0z9YCKgZETngCoAEC,T6IbEIBhb8o,keloheal,кто то бабла рубит на этом мероприятии сейчас неплохое хули желеть беркут или нет они наемники им платят за это народ реально жалко что достались такие ушлепки у власти хз что будет дальше но дальше уже не будет как раньше ,True
Ugg7m8FbUULy83gCoAEC.7-H0Z7-7lHd70bHXeR2uKm,TATn7Q207y0,NiColaj V, дмитрий киевлянин когда коммандировочные беркуту от яныка около штуки баксов в день сложно им думать о совести ,False
UggQq9ZN1zFpkngCoAEC,zCmV4dX5tgs,Виктор ка,соловьёв красавчик всегда мне нравился короткими вставками ,False
UggadD_sEFImS3gCoAEC,GnuEojquj7E,Диванный Эксперт,я бы открыл стрельбу по талпе ведь они угражают жизни своими булыжниками и цепями в пендосси уже бы растреляли ,True
Ugjg5B-9OiVfk3gCoAEC,zCmV4dX5tgs,Дмитрий Бессарабов,читаю комментарии и становится понятно что все кому лень думать вникать во внутреннюю и внешнюю политику россии те за хакамаду именно такие слепо идут на болотную майданы и прочие путчи т к зачем думать нам же сказали за свободу за справедливость крашенинникова уже для таких как вы все разжевала все по полочкам разложила хотя о чем это я это же все равно надо мозг включить и подумать а хакамада так задорно орет что грех ей не поверить ,False
Ugys6n_ewcf_tL4rxNl4AaABAg,ZRhHOMYxVCA,Grzegorz Brzęczyszczykiewicz,молодцы украинцы приятно видеть то как они боролись за свои права и свободы и били поганых мусоров слава украине ,True
UggJ9yhHrk3PXHgCoAEC,eP4ggwPaRts,Victor 56reg,клоуны блядь ,True
Ugj7OTh4krUF4XgCoAEC.7-H0Z7-8iSm7-LhJX2WXKV,TATn7Q207y0,nikolaj fastovec, арина корина обоснуйте своё обвинение с чего вы взяли что я фашист я ведь могу тоже написать что вы трассовая шлюха но если я не обосную то это только голословное обвинение и так с чего вы обвинили меня в фашизме ,True
Ugg6Lqi8aW6AangCoAEC,XW6hWPZglv8,New Divide,слава украине ,False
Ugg7oQeS12uDZHgCoAEC,3OIuCNGkgN4,Шакіров Любомир,молодці так їм ,False
UggiRXNYCNkktHgCoAEC,T6IbEIBhb8o,васёк васьков,эй комментаторы в армии хотя бы в стройбате кто нить служил так не работают снайпера с прикрытием да ещё этот бендеркомментатор в нескольких метрах от злодеев это продолжение сериала предыдущие серии голый хрен с пейсом на макушке потом отрезанные уши и т д ,False
UgjmSQXWn4IlHngCoAEC.7-H0Z7-Hc3-7-Wt-QJJ69w,zCmV4dX5tgs,Ев Завал, мариша клишечто значит сергать люди требуют выборов а не казни это перезагрузка а не свержение если так рассуждать как вы то изменения всегда будут не к месту всегда чего то или кого то не хватает а украина в любом случае не будет без власти ведь есть парламент кабмин местные органы власти ,False
Ugg3dT4eAp1B63gCoAEC.7-H0Z7-0WLA7-J1r6xV5b9,wObv3OVPk30,Александр Шемелин,читай аннотацию ,False
UgjTiRfKi2y0CXgCoAEC,zCmV4dX5tgs,Alex Reutov,я вот не могу понять если я ненавижу януковича вместе с его комуноуголовную семейку и хочу его сместить значит я фашист значит люди которые грабят страну последние года это молодцы классные ребята а те кто хотят его сместить фашисты почему я не имею право в собственной стране развиваться люди которые вышли на майдан хотят только одного иметь право на самозащиту и на саморазвитие мусорские чиновники при януковиче так охамели что могут любого закрыть в часа и надолго милиция в государстве отсутствует медицина отсутствует судов нет и это по мнению россиян хорошо а попытка изменить свою жизнь к лучшему фашизм че за бред нас достала эта комунофашистская мразь которая паразитирует на людях мы просто хотим жить свободно и быть увереными в завтрашнем дне что в этом плохого ,True
Ugg-E_CLwDvOn3gCoAEC,xZUzfzTLD4U,Super Midzy,так вот в чем дело хохлы просто решили снять супер крутой фильм со спецэффектами как у спилберга и экшном как у снайдера обязательно пойду в кинотеатр ,False
UggUJ8dNFM-7cHgCoAEC,NiT0zcDA9RU,vitaliu30,смерть виродкам мусорським до коліна ,True
UgjVlP_zh6M5wngCoAEC,yAqF2rEu-c0,rastapoltava,гори в аду крым донбасс украина оккупантам жестокая смерть путлер капут ,True
Ugit4fIzGfNv83gCoAEC,T6IbEIBhb8o,TKlimate,возникает вопрос почему снайпер только один и где пулеметчики почему их не видно ,False
Ugjv9EBPODhccngCoAEC.7-H0Z7-Roca7-HUVUk9u42,KLugDbnOhws,Felix,так ты двуличный мудак живешь в европе а в украине хочешь видеть зону под паханатом янукевича я не от тебя бабло получаю не волнуйся сибирь пишется через и грн получает титушка баксов беркут баксов тихарь мент ну а снайпер конечно больше и не пори гарячку про снег я тебя умоляю это бред ,True
UghI9hWizIbOBngCoAEC.7-H0Z7-S5yq7-H4IdTHrUY,yjMs_vAV6S8,desrtom, александр пяткин бандеровцев бить можно и нужно ,True
UgiwFyejafWsw3gCoAEC,GItQLVTo4EI,ж ц,идейные дураки ,True
UgzKQ7Hzt2FGD7_shIt4AaABAg,zCmV4dX5tgs,Артур Маннанов,ирина молодец интересная женщина ,False
UgheUk3yl6Ovp3gCoAEC,KUCR8xORoUo,852369951,слава украине ,False
UgjRKVWPhQUnW3gCoAEC,zCmV4dX5tgs,bob g,передачка во главе пидора сасет у путлера и доволен ,True
UgiXBHC7CT_9j3gCoAEC,7xpI5dMsnEM,legat,эти выродки не только о присяге забыли но уже в них ничего человеческого не осталось продались режиму и дьяволу так теперь пусть не удивляются что народ им не только не доверяет но презирает и ненавидит жаль что название беркут как слово нарицательное звучит им больше название из падальщиков подойдет стервятники ,True
Ughw50MaajMaj3gCoAEC.7-H0Z7-R_lN7-I6s5V2rBs,xZUzfzTLD4U,Юра,это не революция а продажные америкосные шестерки ,True
UgjG1EIXs7u90HgCoAEC.7-H0Z7-9Z8q7O9RxykGZH3,IC7sx75-A0Q,nabuchiko, эрик хотя ничего скоро мы все равно мы узнаем всю правду стоит нам только в очередной раз подружиться с американцами они выведут из црушных комнат все это из под грифа и представят на всеобщее внимание и осуждение правда пройдет не мало лет многие даже забудут эту катастрофу ,False
UgiQG6vY9W3OPHgCoAEC,KUCR8xORoUo,Роман Грицай,саша україна з тобою завжди ,False
Ugii_Ne3g_NKlXgCoAEC.7-H0Z7-59tx7-HDujqcdTE,T6IbEIBhb8o,Elvis Presly,скажешь это им когда в тебя стрелять начнут ,False
UgjFW0S-0WWMjngCoAEC,SwZ_LW9NsUE,Gold Times,зажигательными по етим зверям гасить надо ебаные продажные суки стоят там за гр ,True
UgiyJyydIcHZgngCoAEC.7-H0Z7--Q6-70Rh36zFAar,K0icRY1Ae5A,Floki, украина свободная страна вы хотите сказать что на том видео из одессы одни агенты фсб ,False
Ugi_Iu5yLukSZXgCoAEC,FXCliOGt0Jc,Алексей Р,параноидальная мания преследования это про этого гаврика и хрень про все видео в целом ,True
UgggwXhuLExQsXgCoAEC,SwZ_LW9NsUE,сталин иосиф,это бред милиция раздевает и расстреливает провокаторы придумайте что то менее маразматичное ,False
UgjRbOAECULtW3gCoAEC,NiT0zcDA9RU,Svitlana Sumtsova,по видимому беркут заслан с россии ,False
UgjiJFJRxpaK4HgCoAEC.7-H0Z7-4JBi7-HvxBXifsD,uhwtsjFbQK4,Vitalij Kovpak,украину как она есть хочет только тс а ес хочет чтоб мы у себя для начала как минимум порядки понаводили от страны где все держится на откатах и коррупции никому кроме россии пользы нет ,False
UgjXeE7n5tpsxHgCoAEC,T6IbEIBhb8o,medvedkovo2006,так их всех совсем охренели хохлы тока отстреливать и надо ,False
UghZ8UtqSvDGJngCoAEC.7-H0Z7-EUJv7-Jc23E1yXC,zCmV4dX5tgs,Александр Н, анна левицька анна если вы в своем уме то скорее вы платный тролль можно как угодно относиться к крашенинниковой но её доводы просто железные а хака просто жжет и делает эмоциональные выпады ,False
UggqKlsKSSv8iHgCoAEC.7-H0Z7-Dmeb74KKZly5P8V,_k-gDXrfu-s,misslenore1,ваня рус сволочь молись мразь гореть тебе в аду тварь москальская я плюю на тебя и на могилы твоих предков и на твою могилу буду плевать ,True
UgivgDz1nWkBpngCoAEC.7-H0Z7-F5SB763qdCGvdm3,zCmV4dX5tgs,Голубка мира,они только скакать жрать срать спать могут и им этого вполне хватает для счастья ,True
UggHAgZIz0VhjHgCoAEC.7-H0Z7-U_NU7-HoS7Ogra0,K0icRY1Ae5A,Русофобский Жидобандеровец,мудак монголский у тебя печалка твои братья чурки колорады не сняли в одессе свое самосожжение поэтому никаких кадров и нет ,True
UghWSYSzFUoMJHgCoAEC,3NGA7xvqC_Q,Degradation FM,пиздаболия вру ,True
UgyYCmDBdGtdUAQ_bqd4AaABAg,RMxbOKbjX3A,Ульяна Грибко,срубавши голову по волосам не плачут ,False
UghqKxdBy5afdngCoAEC,P0lJZttUnHE,Paul V. Lashkevich,к сожалению очень много нелюди пишет комментарии ,False
UggiHHXA-u28Z3gCoAEC.8AqGCoymfCm8GP4ofe06f3,XW6hWPZglv8,Chesnok,нет лучше оставить их россиюшке что бы она и их разворовала москалям в киев путь закрыт ,False
UgyCdcJ_KVjjVz19a554AaABAg,_k-gDXrfu-s,Net Work,за что стояле сука за новую полицию которая лишь прибавила понтов за цены космические за безвиз который нахер никому не нужен а проще уже визу сделать а за зарплаты в тысячу гривен а сука я за украину и сам я уроп да что толку то нихуя не изменилось ,True
UgjWSQwYWOzeR3gCoAEC,T6IbEIBhb8o,Налим Налимыч,этих беркутовских ублюдков ждет трибунал и зона как и их вора януковича а путин с лукашенко пусть ждут они следующие ,True
Ugi-5b2T-g7XzHgCoAEC.7-H0Z7-BS927076s4gHnxI,XW6hWPZglv8,Денис Путченко, афанасий крутиков ну за гроши с обеих сторон шакалов хватает и насколько я вижу информацию активно искажают с обеих сторон причем обильно посыпают своим мнением хотя нет вряд ли своим а у тебя я вижу мнение о востоке страны уже сложилось и не похоже что ты готов слушать чье то мнение зомби же не люди а значит с ними можно не считаться да и убить не жалко прямо милосердие ,True
UgidBz7HYiRDA3gCoAEC,3KyjqEmLJ7E,сергей титов,а я думаю вместо беркута сталинских пулеметчиков там надо поставить с приказом зачистить площадь от стада бешеных быдлотников сколько же этого дерьма развелося в нашей стране в европу захотели а что они сделали для этого за что голосуют лутше бы работали как все нормалиные люди на заводах и фабриках экономику подымали бы они думают украина европе нужна да плевать она хотела на украину у них своих проблем хватает самая главная проблема у них унижтожить славян любым способом ес это один из этих способов конечно же эта школота сыкунская живущая за мамины и папины деньги этого не поймет куда уж им там за евро бутеры с евро чам они и мать ролную продадут как это сделали ихнии бабки деды продали советский союз за банку гнилых консервов прежде чем идти в европу нужно жить по европейски научиться а не стоять с голым задом и требовать не понятно что ,True
UgiONdml2Y3daXgCoAEC,SwZ_LW9NsUE,Натали Иванова,ахах парни из кировограда там как раз так разговаривают на бендерской мове хоть бы врали красиво и где они бежали че то не увидела ,False
UggQDsIaKWRryXgCoAEC,T6IbEIBhb8o,семен гарельд,у силовиков калаши с другим прикладом а у этих гнид с повязками складные приклады это не силовики а боевики нанятые западом ,True
UgjX2T5Eo27CJ3gCoAEC,gapDCCE1NHU,Сергей К.,цирк а не видео и им это показывают уже весь мир живет в веке а россия все в войнушки хочет играть путин доведет россию до того что будет как с януковичем только бежать ему уже будет некуда жаль нормальных русских которым такую правдивую информацию доносят сми ,False
UgiW_gvLDKexrngCoAEC.7-H0Z7-BpO77-SZnqtcQch,F_y2fwWwyrU,Ярик Олифиренко,разницы нет вас везде одинаково ненавидят ,False
UghH9n3dUarc73gCoAEC,E950t1WGiE0,Жека Царев,лучше бы показали как поджигали заживо офицеров безоружныхи ну и хотя бы за чей счет сартиры содержались ой я забыл же что это канал патриота вити пинчука еврея которого буш и клинтон на юбилей приглашали тогда я не сомневаюсь в не предвзятости красава хорошо работает значит я согласен что сша не причем эти события стихийны а если даже и при чем то они спать спокойно не могли зная что где то в мире есть такой тиран янукович ведь они же любят украинушку матушку всей душой а мы все любим сша ,False
UggHAKHC6rtwjHgCoAEC.7-H0Z7-0KCB7-HHhj3ULj0,NiT0zcDA9RU,SOKILDNISTER,україна совісно й нескорено вставай й бандитам не прощай та всіх гадів гідно наш народе швидше покарай дивіться ютубвідео свтло віри й правди упа та благовіст довбуша все що сталось в киіві було передбачено божими пророцтвами ще з року які є в тих відео та в статтях нашоі інтернетпятірки офіцерів священників упа бандери голодюка попереду опівночі в грудні р має бути ява антихриста і призначення в киів царем путіна й тоді проти нього воскреснуть з небес з синеоким русим христом наші святі героі щоб помогти упа боротися із комунозлом бог нам помагав і поможе упа й украіна переможе щасливо слава украіні слава нації ,False
UghiP00M9i5tKHgCoAEC.7-H0Z7-MWYN7-H3Zsl-Chn,T6IbEIBhb8o,Александр Рудик, макс курбатов беркут применил дозволенную силу а в ответ получили коктейли молотова вот это уже криминал ,False
UghtNP4UmYiRmngCoAEC,NiT0zcDA9RU,xORFEYx,зечара тебя ждет судьба каддафи ,True
