id,video_id,author,text,abusive
Ugj_juuAOLnEK3gCoAEC.7-H0Z7--GGH7-Oek0O6Acm,xZUzfzTLD4U,TheCharlieGordon,зачем они вообще выполняют тупые приказы в вас будут поджигать а вы стойте и терпите какой здравомыслящий человек будет это выполнять и зачем ,False
Ugj5DjHb4ij8_HgCoAEC.7-H0Z7-0Zyq7-LymfRFWa0,zCmV4dX5tgs,Paul Brodskiy, дмитрий шевчук доказательства того что сгоняли проплачено и так далее ,False
UghbLcEnDMeyt3gCoAEC.7-H0Z7-McKd7-_bIbAGXio,zCmV4dX5tgs,Marina Sergeeva,а вы слушали хоть одно выступление хакамады не в этой передаче а вообще троллинг это ваш тренд мне не приписывайте я выше уже ответила что адекватный человек учится везде и у всех или у вас другие любимые авторы так то нарушение заповедей где про кумиров но то что по слову селигер вы безошибочно нашли информацию про нашистов доставляет да и чего это я мне все равно каждый сам для себя все выбирает ,False
UgiU1XubQmfDI3gCoAEC,AyVvGv4Seag,Артур Бо,ляпис предатель беларуси ,False
UgjYaoIfSp3FB3gCoAEC.7-H0Z7-7iPt7-IkpvOWJIF,zCmV4dX5tgs,Gilles de Rais, юрий анатольевич зачем вы это петросянство пишите ,False
UgirTKhLGqB0KHgCoAEC,T6IbEIBhb8o,Green Bot,аїда на берлін хлопці там у металургів зарплати крутіше в україні ловити більше нічого ,False
UghaBWQBQCwM8XgCoAEC,T6IbEIBhb8o,edward247247,боевики стреляют боевыми кулями с гавном ,True
UgjpisCqGFSeSXgCoAEC.8Pax7uM9Drw8PeWJ_TrTEm,ZRhHOMYxVCA,Alex,вы рабы по жизни у вас нет чести и достоинства гражданина поэтому закрой рот и молчи ,False
UgjtwV8InCKJWngCoAEC.86VAVao2lMl89KdLPhT5G2,E950t1WGiE0,Cobb les, спрытны касінер баксы вже по тро ло ло мавпа не здатна усвідомити свою долю як наслідок й передбачити своє майбутьне я здатен пробачити їм такий вчинок а що поробиш вічна пам ять загиблим ,False
UgihZ04LcB7odHgCoAEC.7-H0Z7-Gv_w7-dTpLSGu7w,t8u6l6BNEb0,Roman Pupkin,т е ты хочешь сказать что беркут снял это видео не в ночь числа и не на майдане а потом выложил в интернете якобы это события той ночи открой беньки тебе наеуют твои вожди ,False
Uggu7PycwsIwIXgCoAEC.7-H0Z7-12r18UKA7h2yo7i,E950t1WGiE0,Shiny Mapper,єс ,False
UgjW2y4w6uOS6XgCoAEC,Hz_VhsyVbmI,александр задорожний,мне интересно почему одна часть украины решает как жить другой им кто дал такое право гитлер кто знает просветите ,False
UgiriBupmoeFengCoAEC,qHnRYD3QHWE,sintson,за уши притянуто и вырвано из контекста года ,False
UggaxiB3gFORH3gCoAEC.7-H0Z7-J8lQ7-H7_aH0gvi,NiT0zcDA9RU,Vitalii Kh,наталия вы глупы половина украинцев говорит на русском но при этом русскими не становятся ,False
UgglUMM_3i9ekngCoAEC,oWKz471g0vw,Сергей Перегуда,вечная память вам ребята ,False
Ugi2XIJy8ACoxXgCoAEC.7-H0Z7-EQO_7-K682brayc,zCmV4dX5tgs,aniodchai,не знаю я не медик слушай а может у тебя просто кожа слишком толстая теперь потому и не греют горчичники а в детстве понежнее была вот и чувствовал тогда а украинцы не при чём ,False
UgghEXk6QcEsk3gCoAEC,t8u6l6BNEb0,Николай Богуславский,во время разгона не один добропорядочный труженик не пострадал ,False
UggUkckCcXPkTngCoAEC,7xpI5dMsnEM,Миша Шат, канал просто пиздит ,True
Ugh_VaXGkszEC3gCoAEC,9kuqrT0g_rE,vlad kravtsov,слава украине героям слава хутин сдохни со всей своей швалью ,True
UggDaTDPJMlSO3gCoAEC,x2wWK-zITOs,Максимилиан Эдельман,молитва поможет если народ ее услышит иначе никак ,False
Uggti9ZSquEDY3gCoAEC.7-H0Z7-9hEz7-nUoZgl_wB,Ftny4OUEc6I,Super Mamba, валерий к а щодо в ноги кланятись то не думай що ти царь таких як ти козаки на коліна ставила і хуя в рота правили приємного тобі вечора малий читай книжки розуму набирайся ,True
UgiVA75f0Xv60HgCoAEC,T6IbEIBhb8o,Виталий Викторович,майданутые одним словом банда отморозков на видео не беркут у тех камуфляж синий а это бендеровцы в форме вв ,False
UggR_LtB2Jcnw3gCoAEC,TATn7Q207y0,NiColaj V,начало конца ,False
UggYQGjHcyCwHXgCoAEC,E950t1WGiE0,Александр Бро,это надо больше вылаживать в нэт чтоб всякие дибилы видели что это делалось не за деньги не за зовом кличка или кого ещё а то что это наша страна наша независимость в полном слове и дел чем у тех кто думает иначе слава героям ,True
UghI5WqEssTaqngCoAEC,h7b8R5Jaycw,Дмитро Михайлишин,вже днів пройшло з моменту трагічних подій а висновки не були зроблені здається ми почали забувати за що стояли тоді ,False
UghtIfx1UvYyzngCoAEC,zCmV4dX5tgs,Тарас и Бульба,хакамада стерва она враг ,True
UggumWeNoh_NsXgCoAEC,DXRwSh0iJVY,somka99,конченое старое безмозглое бидло и раби фу пазор ,True
UghxZPQ3iBMp3XgCoAEC,TATn7Q207y0,Павел Иванов,давай сша реагируй по полной сколько можно сопли жевать ,False
Ugjv9EBPODhccngCoAEC.7-H0Z7-Roca7-HVnQD-mzQ,KLugDbnOhws,Дима А,мне за свою грамоту не стыдно согласен что не готовы в украине еще к свободе а то не рабы быстро превращаются в анархистов не хватает политической грамотности гражданской ответственности за будущее ,False
Ughvl63htSfT6ngCoAEC,IC7sx75-A0Q,Сейчас или никогда,украинцы братишки здоровья вам ваш москаль ,False
UghW9gcQEc_0vngCoAEC,LvzCpAFi1BU,Дачтож такое,бля украинцы вам что одной оранжевой мало живёте хуёво а работать не пробовали не сколько барикады не строй сколько в барабаны не стучи сколь угодно яркий оранжевый шарф сколько не повязывай в кошельке и в холодильнике не прибавится пора уже давно понять что за вас ни президент ни вице президент никто не решит ваши проблемы а вы всё выбираете и на той же жопе сидите ждёте что президент вам и квартиры построит и норму на заводе за вас выполнит и жрать вам сварит хуя пора уже давно понять что благополучие в вашем доме целиком зависит от вас а вы мало того что нихуя ничего не делаете так и последнее разваливаете орали всю дорогу что будете незалежными и чё да сколько не ори независимости не прибавится въёбывать надо для этого а не митинговать беларусь вам в пример ,True
UgiXPPtfp98bCngCoAEC,3NGA7xvqC_Q,tandes38,фу не смог досмотреть даже ,False
UghOd5NCAhpHJHgCoAEC.7-H0Z7-HzE48Ei0_cVcu05,wObv3OVPk30,Sergiy Minyuk, александр романов вот ты точно дурак если после более двух лет не понял что воюет против тебя не украина против тебя мягко но неотвратимо покатился каток западной цивилизации и ты руссофашист неважно где ты сейчас – сбежал ли ты от рфии в гейропу или зарабатываешь доллары на брайтон бич будь ты умнее и прозорливее давно бы понял что со всем западом руссогитлеру не совладать потому что невменяемых держат взаперти – особенно если эти невменяемые с гранатой а о подлости не тебе каин говорить после подло лживо украденного крыма это ты ударил своего православного славянского брата ножом в спину – не мы ,True
UgiG50gghvy0CXgCoAEC,zCmV4dX5tgs,Пивоваров Иван,хакамада сватит пить с ельциным и так пол страны пропили ,False
Ughk2gJPqFXX0XgCoAEC,ihixlCUv3tY,Денис Бонд,какой то слабенький разгон препровождают беркут сильно не дубасит не по европейски как то слабенько в париже полиция с несогласными устроила просто кровавую баню короче не сдала украина экзамен на европейские ценности ,False
UggrnscwTfj8A3gCoAEC.7-H0Z7-AlLD7-IyssAu_tz,IqFdatdem64,Ольга Безар,она уже давно в долговой яме и не только у европы давно наблюдаю скандальное поведение некоторых украинцев в различных соц сетях по поводу россии они никак не могут осознать что давно уже граждане независимого государства и россия ничего им не должна за их независимость и надо хорошо работать чтобы хорошо жить какое вам дело кто у нас президент кто в россии с кем и когда поверьте россиянам уже давно обсолютно насрать на всякую продажную политическую шолупень россия независимое государство никому не навязывает свою дружбу и не навязывается в друзья и руководствуется в своей политике своими национальными интересами ,True
UgjDgU9o92Bea3gCoAEC,T6IbEIBhb8o,Udaff Vitaliy,долбоконям в розовых очках живущих все еще на территории как бы советстского союза его нет с года а если не верите слетайте в душанбе или в ташкент а лучше на пяндж или термез через который войска выводили а еще часть территории таджикистана отдана китаю и вообще снимите очки а беркуту в нашей краине полный писец разгоним ,True
Ugh6w63dW3UhaXgCoAEC,zCmV4dX5tgs,lomanteen,враги повсюду европе медленно приходит конец как можно им продаться с потрохами а если хохлы вышли не за европу а за смену власти то тоже ебнулись ,False
UgzUv7Fo5A5ofkdvmt14AaABAg,GnqiftFB1VA,Куплю шкуру Путина,порошенку и яценюку будут памятники ставить потому что они получили страну дырявое корыто после януковоща еслиб не порошенко хер кто бы нам дал денег хер кто нам бы помогал в европе и мире сколько же помощи получили и поддержки или вы думаете что тягнибока или ляшка пригласили бы в сенат сша дали помощи миллиард кредит млрд про яроша вообще не говорю с ним бы и разговаривать никто не стал нет идеальных людей поймите не ждите манны небесной ,True
UgjO7N1YsuaRXHgCoAEC,KLugDbnOhws,Xy .Zanoza, супер конец им западенский гандон на русском заговорил хахахаха это аберег хахаха ,True
UggTLV25HAWgCXgCoAEC.7-H0Z7-7kiy7-HOz5osSFe,NiT0zcDA9RU,Антон Кулмрант,плюю тоже в ебало каждому кто вышел поддержать требования ес о замораживании пенсий и зарплат и повышении тарифов пошли вы нахуй евроассоциаторы и ты вячеслав тоже ,True
UgjIFRKbnUzX83gCoAEC,zCmV4dX5tgs,Gennadi Nadberezhnyi,не тянет крашенинникова на исследователя как она заявляет она похожа скорее на демагога который сам напуган и пугает других а если говорить об истории то имперская история московии сплошь построена на подкупе предательстве и шантаже начиная с полковников носа и галагана и сегодня предатель собственного народа янукович партнёр московского президента не понять россиянам демократических стремлений народа поскольку этой самой демократией у них никогда не пахло и ещё не скоро запахнет не понять им простой истины что рядовые граждане любой страны в сумме богаче правительства банков и корпораций вместе взятых что и подтверждает реальная революция в украине никто не оплачивает майдан люди просто помогают друг другу чем могут как только турция подписала такой же договор с евросоюзом как должен был подписать янукович там начались аресты высокопоставленных чиновников и их родственников связанных с коррупцией беркут спецподразделение созданное исключительно для борьбы с вооруженными террористами применило всё своё умение против безоружных студентов ,False
UggeXg19DwVNFHgCoAEC,3ZRTNLhvw7g,Сергей Токарский,ви вже всіх заїбали москалі їбучі вас треба нахуй всіх гнати знашої землі ,True
UgjgZVAKrP03GHgCoAEC,SwZ_LW9NsUE,Вадим Теряев,интересно эти новости им сам порошенко пишет а почему не показали подрезанных беркутовцев или для канала они не граждане мерзкий канал как и его хозяева ,False
UggdxiiSjMdauHgCoAEC,T6IbEIBhb8o,Draken Snage,я посмотрю на вас путинососы когда кого то из ваших родных пристрелят вякать каждый может не зная опасности за свою свободу хотя ее у вас и нету ,True
Ugi6UCrRxJKrFXgCoAEC,V-fT3lAJEDQ,Martin,клоун ,False
UgitQwG-JU0bKHgCoAEC,ihixlCUv3tY,Gho St,чтоб такого не было надо просто запретить финансировать сми и политические партии иностранными гражданами и физ лицами ,False
UghwLxjlGovrYHgCoAEC.7-H0Z7-JoiD7-HJnI1bRbS,T6IbEIBhb8o,Андрей Краб,это все равно что заявить слава убийствам слава расстрелу собственного народа слава ким чен иру слава сталину слава концлагерям и репрессиям слава ватнику в общем искренне жаль вас ,True
Ugj_U5HeA4JHJXgCoAEC.7-H0Z7-QBQu7-H2cU0215_,6HtbdFfaYUc,Евгений Леонидович,остынь холоп кацапский разбушевалось оно тут херой интернета прыщавый выйди на михайловскую площадь и скажи это людям потом и дерьма твоего там не найдут гы гы гы ,True
UgjSju4DGbL7EHgCoAEC.8FfoDKpJgy38JLyDjnKcZD,zCmV4dX5tgs,Светлана,хакамада кошка которая гуляет сама по себе никогда она народным рупором не была да и предателем не пришлось просто всегда держит нос по ветру и как будто в теме но не при делах ,False
UgjaZSAv3R1c5ngCoAEC,ihixlCUv3tY,MAXHO z,жители украины предлагаю скинуться на зарубежного килера чтобы казнить всех ментов которые стреляли в людей боевыми патронами и убили ,True
Ugj8P262fLRWGXgCoAEC,3KyjqEmLJ7E,Vladimir Vladimirovich,приезжие гастрабайтеры город загаживают а киевляне страдают разбивали бы в своих галициях палатки так нет надо в киев ехать достали ,False
UggFUC7Y9GxHEXgCoAEC.7-H0Z7-1-iO709QpUoJASJ,teQ0Pi-gwv4,максим богомягков,голимый бандитизм сколько у него забрали денег ,False
UgirQ9zu9cBekHgCoAEC,IC7sx75-A0Q,modrá květina,крим належить україні уникайте новому срср ,False
UghkeRI7t-70pngCoAEC.7-H0Z7-B9-X7-K4N2qLnB3,Nb7Lk0v1fwE,вася немайданутый, павел переверзев когда я пишу на эмоциях делаю иногда граммотические ошибки я думаю доценту кафедры органической химии это позволительно ,False
UgidTdaB0olmbHgCoAEC.7-H0Z7-8ZgZ7-HQ0XxACsv,E950t1WGiE0,Людміла Какауліна,как весь мир устал от таких как ты идиотов майдан прежде всего революция против идиотизма слава богу что это произошло ,True
UgyYPkWy0vvkKAUDxuV4AaABAg,AV127gSoJxM,Mr. Alex,народ чё вы срётесь тут причём тут простые гражданские это всё политики виноваты и причём тут обыкновенные люди которые себе мирно живут вините политиков а не нас простых людей это относится ко всем ,False
UgjDyULWlK3bgHgCoAEC,29Im-7fMvtk,Andrej Zimmermann,стадо тупых баранов такой сброд нам в европе нахуй не нужен ,True
UgihUc65zzpAQngCoAEC,T6IbEIBhb8o,IvanovIvan2,в любой цивилизованной стране месяца назад уже бы разогнали всю сволочь с майдана только на укроине силовиков избивали и убивали несколько месяцев дай бог в россии не будет такого идиотизма и влась перестреляет террористов в один день ,True
Ugh5t7HezXzLG3gCoAEC,a3JqkHodL7Y,Ihor Gligol,здохни янукович ти того заслужив ,False
UgiuxXh54K7tpXgCoAEC,9kuqrT0g_rE,Jackson Adrian,воины света воины добра воины володи воины хуйла ,True
UgjIGGcsMgOHHngCoAEC,SwZ_LW9NsUE,pitbull66661,беркут крассавци бейте сильней быдло должно гибнуть гнать пидарасов ,True
UgjMNjmkvPzqGXgCoAEC,zCmV4dX5tgs,Саша Кулицкий,да ни хуя не в курсе темы майдан но как они пиздят шоу бля ,True
Ugi1cHFG6Cpx93gCoAEC,4J7XczzwekA,† GUNÐEBALÐ™ †, побитый сам вызывает себе скорую чё то кровь на лбу краску напоминает бодренько так пробитой головой крутит ,False
Ugh7dMuKflV9f3gCoAEC,T6IbEIBhb8o,H_Socks CANNEL,давно пора мочить бендер ,False
UggoJLVUdi1RqHgCoAEC.7-H0Z7-6RR57-HFP5ihnwH,zCmV4dX5tgs,Евгений Валерьевич,валентина шваб а по чему ,False
UghRWEQV2xaTNXgCoAEC.80ClGbpyhB28JFIfv1tjIL,F88QU2B8ls4,ХИТРОЖОПЫЙ МАЙДАНУТЫЙ УКРОПАТРИОТ,после майдана я сделал уровень жизни украинского народа значительно ниже чем элыдень янукович слава мне благодарю обаму и меркель а украинским нацдурням которые меня поддержали ганьба ,False
